time,id,user_id,parent_id,root_id,reply_count,rt_count,like_count,text,topic,is_cont
2021-03-09T21:50:02.000Z,1369405140705423370,1092378031,-1,1369405140705423370,1,8,8,Dr Seuss 'cancelled'? There’s nothing new about cutting racism from children’s books https://t.co/CA17xgMqVP,Dr Seuss,1
2021-03-09T21:48:09.000Z,1369404666035994625,116640323,-1,1369404666035994625,2,0,7,"They are priced in the thousands, but I doubt they are actually ""selling.""  

(The ppl who are most vocal about wanting those 6 titles have been said to suffer from ""economic anxiety,"" right?)

""Discontinued Dr. Seuss books selling for thousands online""  https://t.co/xEAJWOzjmx",Dr Seuss,1
2021-03-09T21:45:44.000Z,1369404059791355906,18320938,-1,1369404059791355906,22,186,629,Tim Ryan EXPLODES at Republicans on House Floor: 'Stop Talking About Dr. Seuss and Start Working With Us!' https://t.co/Y8AVb3EsRz via @mediaite,Dr Seuss,1
2021-03-09T21:43:22.000Z,1369403462249836544,455684839,-1,1369403462249836544,13,192,1202,"In an alternate universe, where Republicans took the Georgia Senate runoffs, you'd be getting zero ($0) in stimulus money and Republicans would still be gleefully shouting the words from those 6 racist Dr. Seuss books from the rooftops.",Dr Seuss,1
2021-03-09T21:34:46.000Z,1369401298387341312,71086887,-1,1369401298387341312,1,0,3,"Just for those that think cancel culture is going after things - hands up - has any left leaning person ever ""gone after"" Dr.Seuss? Pepe Le Pew? Mr.Potato Head? 

Private business are doing things with their own products. 
No one is coming after these things",Dr Seuss,1
2021-03-09T21:30:02.000Z,1369400106018103300,18086993,-1,1369400106018103300,0,2,6,"In a sensible world, Geisel’s heirs would leave it to parents, educators, and librarians to determine whether Dr. Seuss books should remain available to kids. https://t.co/96PS5U4D0k via @cjstevem",Dr Seuss,1
2021-03-09T21:20:44.000Z,1369397767836143619,236541422,-1,1369397767836143619,0,8,10,".@Tyler2ONeil: ""The SPLC wants schools to turn children into leftist activists, training them to deconstruct American society to find hidden racism everywhere and encouraging them to 'wield power' by eradicating it.""

The @splcenter is a toxic influence. 

https://t.co/38CzV90xFY",Dr Seuss,1
2021-03-09T21:15:00.000Z,1369396323410182150,2369117648,-1,1369396323410182150,1,7,73,"If voters care more about Dr Seuss than the Covid-19 relief plan, they're stupid https://t.co/zayNKaQDXI",Dr Seuss,1
2021-03-09T21:14:59.000Z,1369396320889409540,26165922,-1,1369396320889409540,3,7,46,"I am interested to hear policy ideas from Republicans mad about Dr. Seuss or whatever Amazon did with that anti-trans book.

If they think there’s a problem that needs fixing, why not use the tools of public office to address it unless they’re just being cynical blowhards?",Dr Seuss,1
2021-03-09T21:10:20.000Z,1369395149990662147,267388396,-1,1369395149990662147,0,0,23,BREAKING: Discontinued Dr. Seuss books selling for thousands online proof cancel culture is just liberal ploy to make conservatives read more.,Dr Seuss,1
2021-03-09T21:04:16.000Z,1369393622400053262,147851744,-1,1369393622400053262,4,17,45,"I want you to imagine the following idea: ""Black Market Books""

Now I want you to realize that's exactly what's happening. Because you told people YOU CAN'T READ THAT. Over some damn Dr. Seuss.

Your priorities are fucked up. https://t.co/QMG7aUnmEI",Dr Seuss,1
2021-03-09T21:03:02.000Z,1369393312218689541,192955168,-1,1369393312218689541,6,37,126,"Kids learn prejudice because we teach it to them. By ending publication of certain books, Dr. Seuss Enterprises is helping end this cycle. It's got nothing to do with Green Eggs and Ham &amp; everything to do with protecting kids from bullying and racism. https://t.co/11kHK9FzbG https://t.co/ysQLRrC0cI",Dr Seuss,1
2021-03-09T20:57:38.000Z,1369391954866409473,29465136,-1,1369391954866409473,3,18,54,Tim Ryan EXPLODES at Republicans on House Floor: 'Stop Talking About Dr. Seuss and Start Working With Us!' https://t.co/kCapm29PbM,Dr Seuss,1
2021-03-09T20:52:49.000Z,1369390741248696321,745301594028318720,-1,1369390741248696321,0,2,25,".@RepTimRyan: ""Stop talking about Dr. Seuss, and work with us …” 🔥 https://t.co/BGpPfX78iW",Dr Seuss,1
2021-03-09T20:43:30.000Z,1369388395642896384,13491312,-1,1369388395642896384,2518,5607,26059,It had to be said. Our Republican colleagues are busy talking about Dr. Seuss when they should be working with us to help the American people. https://t.co/Mc7IwFlb25,Dr Seuss,1
2021-03-09T20:34:23.000Z,1369386102889517056,86384980,-1,1369386102889517056,6,4,9,"""Currently all copies of the 6 Dr. Seuss books are checked out, with additional holds. Holds will be honored but the titles will not return to shelves. The library plans to temporarily keep the books as reference copies while it assesses long-term options"" https://t.co/GdkqFtUbUc",Dr Seuss,1
2021-03-09T20:31:20.000Z,1369385336032362509,236541422,-1,1369385336032362509,2,2,7,".@HoppeGeoff teaches as he entertains, en hommage to a certain author now much on our public mind 

How Learning for Justice Stole Dr. Seuss https://t.co/hF3if6g7BQ",Dr Seuss,1
2021-03-09T20:23:32.000Z,1369383371055521794,3497941,-1,1369383371055521794,8,7,77,"its just a question of which gop ad uses dr seuss first, not if theyre going to use it.",Dr Seuss,1
2021-03-09T20:18:23.000Z,1369382077947330563,21862425,-1,1369382077947330563,21,12,20,"An actual NRSC fundraising email: ""Trump eliminated global terrorist threats. He fought to keep Americans safe, killing Abu Bakr al-Baghdadi and Qasem Soleimani when they threatened American lives. Meanwhile, Joe Biden has only gone after Dr. Seuss and a plastic potato head."" https://t.co/VM4CPFOgI3",Dr Seuss,1
2021-03-09T20:17:40.000Z,1369381894824017923,42138367,-1,1369381894824017923,0,5,29,"Ohio Rep. Tim Ryan goes off on Republicans on the House floor. 

""Stop talking about Dr. Seuss, and start working with us on behalf of the American workers."" https://t.co/yg36HirNhK",Dr Seuss,1
2021-03-09T20:15:32.000Z,1369381361002364936,116547240,-1,1369381361002364936,2,0,2,"This conversation about Dr. Seuss went off the rails, fast: https://t.co/lse1TALVXg",Dr Seuss,1
2021-03-09T20:14:50.000Z,1369381181305872388,288277167,-1,1369381181305872388,120,81,970,it's the new Dr Seuss https://t.co/5tTqCdTJYc,Dr Seuss,1
2021-03-09T20:13:05.000Z,1369380744343257091,1087380412089987077,-1,1369380744343257091,2037,21829,79036,"Rep. Tim Ryan (D-OH) yells at the GOP over union organizing bill: “Heaven forbid we pass something that’s going to help the damn workers in the United States of America.”

He adds: “Now stop talking about Dr. Seuss, and work with us …” https://t.co/0RbmxQUPxB",Dr Seuss,1
2021-03-09T20:10:08.000Z,1369380000324087809,33567986,-1,1369380000324087809,5,2,44,"""Gee, Tessa, I don't know what happened to your Dr. Seuss books..."" https://t.co/WY76OvZIJM",Dr Seuss,1
2021-03-09T20:08:46.000Z,1369379654470168577,9567972,-1,1369379654470168577,30,96,405,"To show how cancel culture created a GOP distraction which helped President Biden pass his Covid-19 relief bill, @brikeilarcnn pulls on her Dr. Seuss hat (the red and white-striped one):

""The Republicans said no, unanimous no go, too much, too fast, too good for Joe,"" she rhymes https://t.co/YskECgU3zV",Dr Seuss,1
2021-03-09T20:08:33.000Z,1369379600145481733,432557320,-1,1369379600145481733,1,1,2,"During WWII, Dr. Seuss tried to slay anti-Semitism, but also promoted racism https://t.co/S4DDqEenuy",Dr Seuss,1
2021-03-09T20:05:07.000Z,1369378736047616008,15675138,-1,1369378736047616008,92,579,1599,".@RepTimRyan: ""Heaven forbid we pass something that's going to help the damn workers in the United States of America! Heaven forbid!"" He concludes, ""Now, stop talking about Dr. Seuss and start working with us on behalf of the American workers."" https://t.co/aMR5hPssYI",Dr Seuss,1
2021-03-09T20:00:56.000Z,1369377685231788035,82689705,-1,1369377685231788035,0,10,27,"Fox News, like most of right-wing media, has largely ignored the Covid relief legislation, instead fixating on silly culture war controversies involving Mr. Potato Head and Dr. Seuss. https://t.co/IxszI8iRs1",Dr Seuss,1
2021-03-09T19:58:20.000Z,1369377031390126088,23022687,-1,1369377031390126088,1874,585,3062,"Agreed.

❌ socialism
❌ open borders
❌ taxpayer $$ for criminals &amp; illegal aliens
❌cancel culture
❌ closed schools

VS. low taxes, lots of jobs, secure borders, free speech,  open schools...and Dr. Seuss.

It’s not a fair fight. https://t.co/GbLwELn9pB",Dr Seuss,1
2021-03-09T19:50:29.000Z,1369375054140702720,1917731,-1,1369375054140702720,168,1419,5712,"Rep. Tim Ryan: ""Stop talking about Dr. Seuss and start working with us on behalf of the American workers."" https://t.co/UcMqMmafyR",Dr Seuss,1
2021-03-09T19:42:56.000Z,1369373154783662082,334894942,-1,1369373154783662082,2,7,54,"I hope Republicans have enjoyed the past couple weeks trying to get people outraged over Dr. Seuss being ""cancelled.""  Meanwhile, some really important things are moving forward in Congress, and the Biden administration is leading on COVID.  #Governing",Dr Seuss,1
2021-03-09T19:39:39.000Z,1369372328367448070,1152385955187298304,-1,1369372328367448070,2,5,43,Good lord..  this @brikeilarcnn Dr. Seuss poem on the American Rescue plan was perfect,Dr Seuss,1
2021-03-09T19:35:55.000Z,1369371390927925254,1953117589,-1,1369371390927925254,1,1,1,"INBOX: @CAPAC Leaders Thank Estate of Dr. Seuss &amp; Criticize Republican Leaders who Downplay Anti-Asian Racism

""This has nothing to do with books like Green Eggs and Ham ... and Rep. McCarthy knows that. By intentionally obfuscating, he is continuing to excuse racism.""",Dr Seuss,1
2021-03-09T19:34:21.000Z,1369370995379802121,139186916,-1,1369370995379802121,0,1,17,"But they will have to spend all that money to be able to afford newly out of print Dr. Seuss books, so it's a wash https://t.co/dcFRB4TH9x",Dr Seuss,1
2021-03-09T19:30:00.000Z,1369369899408232449,21258337,-1,1369369899408232449,54,11,42,"CONTROVERSY OVER SEUSS BOOKS PULLED FROM EBAY: After Dr. Seuss’ family pulled six of his titles from publication for containing racism imagery, eBay has announced they will not feature the titles—the co-hosts react and question if the site should do the same to other works. https://t.co/9Mq1H0P30X",Dr Seuss,1
2021-03-09T19:27:11.000Z,1369369191837556740,218975278,-1,1369369191837556740,25,92,528,"So far:
No cat update
Major + Champ will back.
No Biden signature on the $1400 check (cause he's not a raging narcissist)
Reporters still obsessed with ""bipartisanship"" defined as getting Dr. Seuss obsessed, insurrection ignoring R's in Congress on board.",Dr Seuss,1
2021-03-09T19:20:23.000Z,1369367480418844673,45795129,-1,1369367480418844673,30,36,577,I just bought Dr. Seuss “Hop on Pop” on Amazon for $4900 but then I realized that it’s not one of the ones that was banned :(,Dr Seuss,1
2021-03-09T19:19:01.000Z,1369367137429688323,2696503964,-1,1369367137429688323,0,3,1,"The predictions that quarantine would lead to a net growth in the birth rate were optimistic, to say the least. https://t.co/8q47Z1RqOI",Dr Seuss,1
2021-03-09T19:18:48.000Z,1369367080550735872,490716931,-1,1369367080550735872,0,0,0,"I don’t care about Piers Morgan, Dr Seuss or Mr Potato Head changing his name. We have real problems and need real solutions. These are distractions because the GOP would rather stoke culture wars than fight covid and help people.",Dr Seuss,1
2021-03-09T19:16:14.000Z,1369366435533819909,976562816772722689,-1,1369366435533819909,0,0,0,"This is because of Democratic leadership. Meanwhile, the @GOP is still stressing about Dr. Seuss. https://t.co/qEyKiU5z7J",Dr Seuss,1
2021-03-09T19:12:11.000Z,1369365414862524416,2475407894,-1,1369365414862524416,10,270,674,House Dem Caucus Chair Hakeem Jeffries: “House Dems are the party of crushing coronavirus and providing relief. House Republicans are the party of fake outrage as it relates to Dr Seuss. It is a strange thing.”,Dr Seuss,1
2021-03-09T19:10:30.000Z,1369364992118644746,323385873,-1,1369364992118644746,0,1,5,"why didn't you quote the racist shit they pulled from the shelves instead of ""Brainy Quote Dr. Seuss?"" 

Like they said throughout your career:

swing and a miss. https://t.co/Vf1mf1L9uf",Dr Seuss,1
2021-03-09T19:10:00.000Z,1369364865710624768,32871086,-1,1369364865710624768,49,1462,6442,"House Democratic Caucus Chair Hakeem Jeffries: ""House Democrats are the party of crushing the coronavirus and providing relief to everyday Americans. House Republicans are the party of fake outrage as it relates to Dr. Seuss. It is a strange thing.""",Dr Seuss,1
2021-03-09T19:01:37.000Z,1369362758026854400,474464413,-1,1369362758026854400,0,0,2,"""House Republicans are the party of fake outrage as it relates to Dr. Seuss."" https://t.co/EpXWn9pusI",Dr Seuss,1
2021-03-09T19:00:01.000Z,1369362355683880961,17602348,-1,1369362355683880961,0,1,1,"“I don’t think you can call that ‘cancel culture’ — I believe what we are looking at is critically thinking about content,"" said Deborah Caldwell-Stone, director of @OIF.

https://t.co/T9Q8J6i3j1",Dr Seuss,1
2021-03-09T18:53:39.000Z,1369360752407048192,17454769,-1,1369360752407048192,49,137,550,"Yes, John Oliver. Banning Dr. Seuss books (in libraries, on Ebay, etc) IS fascistic. https://t.co/4PZQaUzUu7",Dr Seuss,1
2021-03-09T18:46:24.000Z,1369358929495547906,242374336,-1,1369358929495547906,0,3,3,House Democrat says his party is 'crushing the coronavirus' while the GOP is tied up with 'fake outrage' over Dr. Seuss https://t.co/zHJRigTW41,Dr Seuss,1
2021-03-09T18:45:26.000Z,1369358684271284231,1917731,-1,1369358684271284231,19,60,197,"Rep. Hakeem Jeffries: ""The party of the American Rescue Plan versus the party of Marjorie Taylor Greene, Ted Cruz, and Dr. Seuss is not really a fair fight."" https://t.co/0vSP1GaYce",Dr Seuss,1
2021-03-09T18:44:54.000Z,1369358550850473987,252643801,-1,1369358550850473987,1,3,48,I demand the dr. seuss estate broadcast Piers Morgan live 24/7,Dr Seuss,1
2021-03-09T18:35:25.000Z,1369356161733033985,236487888,-1,1369356161733033985,45,12,121,"Yes, outside of Dr Seuss, this is all Fox News and Republicans want to talk about. And, yes, they are using this issue to rile up their base. But, we have a burgeoning problem at our border, these immigrants are coming because Biden isn’t Trump, and Biden better get on top of it. https://t.co/0EWmczrRay",Dr Seuss,1
2021-03-09T18:33:47.000Z,1369355753979580417,91478624,-1,1369355753979580417,94,131,444,"2022 OUTLOOK: Rep. Hakeem Jeffries slams GOP: ""The party of the American Rescue Plan vs. the party of Marjorie Taylor Greene, Ted Cruz, &amp; Dr. Seuss is not really a fair fight."" https://t.co/RjzrHymc6D",Dr Seuss,1
2021-03-09T18:19:33.000Z,1369352171091881989,784286232511520773,-1,1369352171091881989,2,1,2,Is the move to stop publishing six Dr Seuss books another example of cancel culture - or an acknowledgement that we've moved on from a more insensitive past?  https://t.co/ns656WJdjN,Dr Seuss,1
2021-03-09T18:17:22.000Z,1369351623189934089,12848262,-1,1369351623189934089,6,8,2,"⚡️ “Discontinued Dr. Seuss books selling for thousands online”

Story by @brianjbradley 
https://t.co/dihe0vM3hk",Dr Seuss,1
2021-03-09T18:15:09.000Z,1369351062503759876,89005882,-1,1369351062503759876,6,3,1,Chicago Public Libraries to yank canceled Dr. Seuss books @washtimes https://t.co/aqHuVvi76A,Dr Seuss,1
2021-03-09T18:14:08.000Z,1369350806785433611,1517530292,-1,1369350806785433611,0,1,2,"After months of discussion, Dr. Seuss Enterprises decided to no longer publish six Dr. Seuss titles. 

Use this article to explain to students how the business came to this decision: https://t.co/oBP9of0uVS https://t.co/ByfvkquOZp",Dr Seuss,1
2021-03-09T18:09:01.000Z,1369349519872262154,22063600,-1,1369349519872262154,0,1,16,Dr. Seuss has no connection whatsoever with one of our major parties. The GOP is fabricating a fake controversy but for all we know the guy’s estate could be managed by stalwart Republicans. https://t.co/WPO9eCtsce,Dr Seuss,1
2021-03-09T18:06:59.000Z,1369349006367854593,12848262,-1,1369349006367854593,5,3,11,"Within hours of Dr. Seuss Enterprises announcing a plan to discontinue six books deemed racist, popular online retail websites and private groups saw a rise in ads selling the titles with inflated resale costs.

Story by @brianjbradley 
https://t.co/LCgB8rmyQd",Dr Seuss,1
2021-03-09T18:05:03.000Z,1369348520113672197,19625120,-1,1369348520113672197,0,2,3,Can We Talk About Dr. Seuss's Boners? https://t.co/rUHRrKgeEc,Dr Seuss,1
2021-03-09T18:01:13.000Z,1369347558598995980,14662354,-1,1369347558598995980,8,7,6,Chicago Public Libraries to yank canceled Dr. Seuss books https://t.co/p1rV40wIEy,Dr Seuss,1
2021-03-09T17:42:00.000Z,1369342719743586304,604940737,-1,1369342719743586304,13,6,171,One crucial fact that is getting lost in the discourse is that Dr. Seuss wrote and drew books for kids.,Dr Seuss,1
2021-03-09T17:40:15.000Z,1369342279954149376,70518745,-1,1369342279954149376,5,17,92,"This thread is also a good answer to the ""why do you even care about 6 obscure children's books"" argument vis-a-vis Dr. Seuss: without pushback, a false narrative takes hold that can then be used to impugn everything the author ever touched https://t.co/fuOSLdrpM8",Dr Seuss,1
2021-03-09T17:39:21.000Z,1369342054447390722,2479845637,-1,1369342054447390722,2,1,5,"""[I'm] over it today!"" A discussion about Dr. Seuss quickly escalated into a screaming match between Meghan McCain and Joy Behar on #TheView: https://t.co/3Oj9G5SHCF https://t.co/8rWvk0TTRh",Dr Seuss,1
2021-03-09T17:35:06.000Z,1369340986414030855,3274751658,-1,1369340986414030855,0,0,0,Apparently Sleeping Beauty used to be impregnated in her sleep — and other childrens’ stories that have changed as our sensibilities did https://t.co/SopGryvFSg,Dr Seuss,1
2021-03-09T17:30:32.000Z,1369339837392723969,1076888720,-1,1369339837392723969,1,3,16,"Judy Murray: Of course, we still like Green Eggs and Ham but it is right to retire some books by Dr Seuss https://t.co/tObTkVKZhn @judymurray https://t.co/qGmE7voQds",Dr Seuss,1
2021-03-09T17:28:03.000Z,1369339211858460674,482388629,-1,1369339211858460674,2,5,22,"New from me in the #DrSeuss debate: Who are the hypocrites?

https://t.co/2CcsXrVrvn",Dr Seuss,1
2021-03-09T17:26:04.000Z,1369338711368867840,429227921,-1,1369338711368867840,304,1056,4512,"You know why the right-wing is talking about Dr. Seuss, Mr. Potato Head and Pepe Le Pew now? Because they don't have a single policy proposal that would help anyone in the country, other than the super rich. So, they have to distract you with culture wars.",Dr Seuss,1
2021-03-09T17:22:31.000Z,1369337819135672329,15446531,-1,1369337819135672329,11,6,84,"Life as an independent writer means nobody can stop you from putting this digression about ""City on Fire"" into your article on Dr Seuss.

https://t.co/DDYejyDa6R https://t.co/Xed5piu2E6",Dr Seuss,1
2021-03-09T17:19:33.000Z,1369337069726691328,22001973,-1,1369337069726691328,4,26,71,Dr Seuss 'cancelled'? There’s nothing new about cutting racism from children’s books https://t.co/f9KRBG7rVR,Dr Seuss,1
2021-03-09T17:13:30.000Z,1369335548419207186,983115531296432130,-1,1369335548419207186,0,1,0,"Something tells me when people have money in their account and the economy Is booming, Dr. Seuss Will be the last thing on their mind.
You really are bad this, ya know? https://t.co/BIFk6fneqA",Dr Seuss,1
2021-03-09T17:07:44.000Z,1369334097609302016,54976483,-1,1369334097609302016,0,8,35,"Thanks to how copyright works, you can draw and publish your own racist caricatures any time you like, rather than depend on the goodwill of the Dr Seuss estate.

See, copyrights are not like patents.",Dr Seuss,1
2021-03-09T17:01:14.000Z,1369332459725328385,205251093,-1,1369332459725328385,1,0,2,"Today's 202 w/ @oknox: Dems promoting the aid bill are trying to avoid a repeat of '09, when a $787b stimulus helped the rise of the tea party. Still, GOP hasn't unified behind a line of attack. They appear more preoccupied with Dr.Seuss &amp; Mr. Potato Head: https://t.co/YLitLmhbzB",Dr Seuss,1
2021-03-09T16:58:49.000Z,1369331852109037575,3940101,-1,1369331852109037575,0,0,0,Fair and sober analysis of the Dr. Seuss situation.  Worth a read no matter what side you come down on.  Thanks @CathyYoung63 for the article https://t.co/X4bdigPdIG,Dr Seuss,1
2021-03-09T16:57:05.000Z,1369331416706727942,52644968,-1,1369331416706727942,1,2,7,"To Republicans, Dr Seuss is more important than a COVID relief plan because ""more voters will remember [it.]""

This is why they are incapable of governing. This is why they should never be trusted with you or your families lives. https://t.co/bDLbX89YLd",Dr Seuss,1
2021-03-09T16:53:50.000Z,1369330600767725571,21059255,-1,1369330600767725571,125,1220,5811,"Under the Dem’s #AmericanRescuePlan, you can keep buying Dr. Seuss books like Green Eggs and Ham.

Also, the legislation will make your life better by delivering stimulus checks, tax credits, unemployment benefits &amp; small business loans. The bill also helps fund the police.",Dr Seuss,1
2021-03-09T16:51:41.000Z,1369330058284961792,70424767,-1,1369330058284961792,2,1,31,"You, an idiot: “Let’s argue about Dr. Seuss!” 
Me, a brain-genius: https://t.co/QhkzJw6wm0",Dr Seuss,1
2021-03-09T16:50:10.000Z,1369329674891968514,14116588,-1,1369329674891968514,3,10,32,"Maybe the Bible won't be cancelled after Dr. Seuss and ""When Harry Became Sally."" Progressives mock the idea. OK; I have a question:

Why not?

https://t.co/mS87G3OEP4 | via https://t.co/fLUkRw9tnN",Dr Seuss,1
2021-03-09T16:48:40.000Z,1369329298578935808,14046504,-1,1369329298578935808,5,3,31,A very informative @mattyglesias post on copyright policy https://t.co/ym084lyfsI Note especially the part about orphaned works. I don't know exactly the right number of years of protection but what we've got is way too long.,Dr Seuss,1
2021-03-09T16:45:02.000Z,1369328383415422983,23655688,-1,1369328383415422983,1,1,2,Dr. Seuss children's books are hardly the first titles to cause controversy for libraries https://t.co/x7xpS4MaVP https://t.co/lYlc7wfoIn,Dr Seuss,1
2021-03-09T16:36:04.000Z,1369326128175984647,2471692340,-1,1369326128175984647,56,108,623,I wish the Right would stop getting its shorts in a bunch over every little thing that doesn’t mean crap in the long run. Skip Dr. Seuss! Skip Meghan Markle! Skip Prince Harry! Y’all making it hard for some of us “real ones” thats out here in these real streets in the real world!,Dr Seuss,1
2021-03-09T16:32:40.000Z,1369325271434813446,17469289,-1,1369325271434813446,77,19,35,Chicago Public Library to yank six Dr. Seuss books from shelves https://t.co/r5Obo5IR7A https://t.co/lIS1sg1vr4,Dr Seuss,1
2021-03-09T16:28:53.000Z,1369324320044974081,21059255,-1,1369324320044974081,130,749,2955,"The below person thinks the American people are stupid. We are not stupid. Voters know Dems did not pass any laws regulating Dr. Seuss. They also know Dems passed a law that delivered stimulus checks, unemployment benefits, tax credits &amp; small business loans.

#AmericanRescuePlan https://t.co/iaLoFSyH7V",Dr Seuss,1
2021-03-09T16:28:18.000Z,1369324173596766211,15138822,-1,1369324173596766211,5,1,86,“It’s not just the cancelling of Dr. Seuss but of Mr. Potato Head.” - Meghan McCain and the moment I literally yelled many swear words at my television so yes I am ready to go back to work thank you.,Dr Seuss,1
2021-03-09T16:25:03.000Z,1369323354042363918,1075085484,-1,1369323354042363918,0,0,0,"#LetterstotheEditor - #Dallas business owner’s concerns over no masks, advice to fix the #Texas power grid, #DrSeuss, #Texas leadership https://t.co/V7PgqXuGln",Dr Seuss,1
2021-03-09T16:20:56.000Z,1369322319714353152,1087380412089987077,-1,1369322319714353152,13,84,351,".@RepJeffries (D-NY) on the COVID relief bill and GOP: 

“House Republicans are the party of fake outrage as it relates to Dr. Seuss.” https://t.co/C1sg6Czyft",Dr Seuss,1
2021-03-09T16:20:08.000Z,1369322120182894596,143500773,-1,1369322120182894596,4,4,17,"Can't wait to see conservatives marching to the polls next year, proclaiming themselves ""Dr. Seuss Republicans"" https://t.co/7Tk1ersPkN",Dr Seuss,1
2021-03-09T16:15:12.000Z,1369320875829338113,2889924959,-1,1369320875829338113,8,11,51,I’m kinda puzzled why they are all up in a knot over Dr Seuss but Curious George gets a pass? https://t.co/hffMToMQU6,Dr Seuss,1
2021-03-09T16:14:25.000Z,1369320678269280266,42432103,-1,1369320678269280266,4,1,28,"Leaving aside that this isn’t something to be proud of, it also seems like anyone who is still mad about the Dr Seuss thing in 2022, let alone associates it with “the Democrats”(?), was always going to vote Republican anyways https://t.co/KYvViCeTbw",Dr Seuss,1
2021-03-09T16:13:32.000Z,1369320459620261889,14321959,-1,1369320459620261889,7,28,84,Nobody much cares about the kids in the camps. They never have. America’s right back to Dr Seuss and celebrity politics and other assorted bs. Nothing in my life has been more revealing of the truth of who america really is than that one fact. It’s just a fascist country,Dr Seuss,1
2021-03-09T16:13:32.000Z,1369320455975432202,14864105,-1,1369320455975432202,0,0,1,Was just thinking about how much more grating and loud the Dr. Seuss stuff would be in Trump were able to tweet about it. His lost account is sort of like a phantom limb for the Republican Party.,Dr Seuss,1
2021-03-09T16:09:11.000Z,1369319364328124428,889745082,-1,1369319364328124428,1,10,23,"The GOP *could* have focused on the Dems' COVID package instead of Dr. Seuss.

They chose not to because it was polling at 76%, including 60% of Republicans!
https://t.co/HZSGLDWBBe https://t.co/a2auF2BVDv",Dr Seuss,1
