time,id,user_id,parent_id,root_id,reply_count,rt_count,like_count,text,topic,is_cont
2021-03-09T00:36:18.000Z,1369084593685622784,16459325,-1,1369084593685622784,2,0,10,Stop for a second and imagine what the previous president would be doing in a White House press conference with talk about Pepe Le Pew and Dr. Seuss.,Dr Seuss,1
2021-03-09T00:33:46.000Z,1369083957497716737,1268223690480615424,-1,1369083957497716737,34,331,1267,"""We’re in the middle of a pandemic, jobs crisis and economic recession and you have a Republican Party that’s trying desperately to brand itself the party of working people and yet when working people need help, their elected officials can’t stop fucking talking about Dr. Seuss."" https://t.co/lbDAWmbnj9",Dr Seuss,1
2021-03-09T00:16:14.000Z,1369079544544718849,352548417,-1,1369079544544718849,3,12,109,"Yes, but what about Dr. Seuss?  What about Mr/Ms. Potato Head?  Where are your priorities, man? https://t.co/mEiUrp5YrU",Dr Seuss,1
2021-03-09T00:01:05.000Z,1369075733017067521,2249022318,-1,1369075733017067521,5,1,6,"And the far-left continues to encourage cancel culture...

Let's not forget that kids have grown up all around the world reading and loving Dr. Suess! 
https://t.co/B2MDZY4Jpi",Dr Seuss,1
2021-03-09T00:00:49.000Z,1369075666549837824,604940737,-1,1369075666549837824,25,5,120,Remember the Alamo. Remember The Main. Remember Pearl Harbor. Remember 9/11. Remember Dr. Seuss.,Dr Seuss,1
2021-03-09T00:00:31.000Z,1369075589618012160,19940347,-1,1369075589618012160,0,0,1,"Readers Write: Please, no repeat of last summer. #DerekChauvinTrial #GeorgeFloyd #Minneapolis https://t.co/t1vExaZH5P",Dr Seuss,1
2021-03-08T23:46:00.000Z,1369071937339678722,16467567,-1,1369071937339678722,8,56,142,"Disappearing books from library shelves gets us closer to the classic example of censorship. Activist educators are peddling a false narrative about the beloved child author's books and characters.

https://t.co/P03H9hWHoa",Dr Seuss,1
2021-03-08T23:40:01.000Z,1369070430020046851,3135241,-1,1369070430020046851,2,15,24,"The Woefully Ignorant Media Is Getting America's Anger Over the Cancelation of Dr. Seuss Books So Wrong, So Let Me Help 
 https://t.co/Qdqyv6oFuR",Dr Seuss,1
2021-03-08T23:36:12.000Z,1369069472439406601,78683448,-1,1369069472439406601,100,184,1937,"Jordan Peterson is a true dark horse. 

Check out our DarkHorse Podcast conversation. @jordanbpeterson and I cover a lot of fascinating ground from Jung and Freud to Dr. Seuss. 

I am so pleased Jordan is rejoining they fray. 

Welcome back, Doc!

https://t.co/oBJ4KrLNRu",Dr Seuss,1
2021-03-08T23:33:32.000Z,1369068800834859008,4081106480,-1,1369068800834859008,31,23,67,Chicago Public Library Removes Several Dr. Seuss Books From Collection While They Assess https://t.co/ofOqTPGBKP https://t.co/v3f2ae4zOJ,Dr Seuss,1
2021-03-08T23:20:38.000Z,1369065554498162694,14216661,-1,1369065554498162694,5,0,7,Dr. Seuss children's books are hardly the first titles to cause controversy for libraries https://t.co/oOyFmBLjFi,Dr Seuss,1
2021-03-08T23:20:02.000Z,1369065400789516288,19417492,-1,1369065400789516288,10,12,29,"There’s no consistent, much less scientific, measure of racism. That’s the problem. Nobody can keep track of the rules. | Opinion by @rkylesmith https://t.co/P3mCBIGmdn",Dr Seuss,1
2021-03-08T23:17:31.000Z,1369064767059558402,19638751,-1,1369064767059558402,1,5,15,"While Biden leads....Dr. Seuss readings, retirements, and this.... https://t.co/XvcxnP8ACf",Dr Seuss,1
2021-03-08T23:06:00.000Z,1369061869499994114,14532773,-1,1369061869499994114,0,3,4,"Swanson’s Frozen Dinner heir, @TuckerCarlson, on Dr. Seuss Enterprises’ free enterprise decision to stop printing six of its own children’s books depicting racially derogatory imagery. https://t.co/9FXOYWjzyA https://t.co/44Mp1xldDu",Dr Seuss,1
2021-03-08T23:05:39.000Z,1369061782803906560,14844867,-1,1369061782803906560,192,307,2758,It’s gonna take Republicans a few weeks to realize how badly they got rolled on the COVID bill while they wasted all their precious time and energy whining about Dr. Seuss.,Dr Seuss,1
2021-03-08T23:05:38.000Z,1369061779754586116,2361224263,-1,1369061779754586116,0,6,19,"Just as the Grinch’s heart grew two sizes after his Yuletide epiphany, the true meaning of Dr. Seuss is arising in the hearts of Americans. 

As of Friday morning 15 out of Amazon’s top 20 list for bestsellers were Dr. Seuss works. https://t.co/d8zbPMhBXy",Dr Seuss,1
2021-03-08T23:00:02.000Z,1369060367658348544,12055942,-1,1369060367658348544,0,0,1,"Opinion: Six Dr. Seuss books bore a bias
https://t.co/GQQqs8EOlo",Dr Seuss,1
2021-03-08T22:46:14.000Z,1369056897794404352,299051663,-1,1369056897794404352,2,0,4,"The only Dr. Seuss book to receive a complaint at the Toronto library before 2021 was Hop on Pop, for, allegedly, promoting violence against fathers https://t.co/cLntH1rDtj",Dr Seuss,1
2021-03-08T22:44:05.000Z,1369056355504553985,2836421,-1,1369056355504553985,46,140,594,".@AliVelshi:

""Let me tell you a story that's based in the truth
They say they're cancelling a doctor, cancelling Dr. Seuss!
How these rumors began should not fill you with shock
As you can probably imagine many started on Fox.""

https://t.co/TcI8WBwwIJ",Dr Seuss,1
2021-03-08T22:42:01.000Z,1369055835104673793,369722197,-1,1369055835104673793,0,0,0,"“I’ve long questioned whether or not I can separate the artist from the work, and it’s something I struggle with on a case-by-case basis. In this instance, I’m not conflicted.”

Read more here: https://t.co/XLBzzzreiz",Dr Seuss,1
2021-03-08T22:31:37.000Z,1369053215946334217,3286471,-1,1369053215946334217,0,0,1,"So not only do they not know how to read (see, Dr. Seuss), they don't know how to listen. Meghan wasn't the originator of that story. That story was told to her by HARRY HIMSELF. Harry put his family on blast. She even corrects Oprah that those convos where had with Harry. https://t.co/fzLJClsNp2",Dr Seuss,1
2021-03-08T22:19:51.000Z,1369050258295169026,24266534,-1,1369050258295169026,1,1,5,"I have a theory as to the real reason Dr. Seuss was ""cancelled""...

WATCH &gt; https://t.co/2pDbpwe0Uy

#JonReep #Countryish #DrSeuss #cancelculture @allthingscomedy https://t.co/gikohueHQ3",Dr Seuss,1
2021-03-08T22:17:32.000Z,1369049671491063813,18766459,-1,1369049671491063813,23,74,317,The right is currently defending Officer Chauvin’s right to murder George Floyd (he was a druggie criminal so…) and the Palace’s right to assassinate Meghan’s character (she’s lying!) and Dr. Seuss’s right to publish racist drawings. Can you be on the wrong side of every issue?,Dr Seuss,1
2021-03-08T22:11:04.000Z,1369048047368380420,34559099,-1,1369048047368380420,0,0,8,"Join us toda for this killer convo on the ⁦@app_stereo⁩ ,where we discuss why “Dr. Seuss is NOT cancelled”, on the Stereo App on Mar 08, 03:00 PM (PST) https://t.co/6m98v2mDm4
https://t.co/2q6mrTIn82",Dr Seuss,1
2021-03-08T22:04:52.000Z,1369046483681435652,16007071,-1,1369046483681435652,3,0,9,"People are trying to put the irrational Dr. Seuss shit in the rational box of copyright reform. Which makes things hard because a) it makes explaining the issues emotionally charged and weird and b) they're acting in bad faith, poisoning the good faith work of reform advocates https://t.co/2Arc9a8h6I",Dr Seuss,1
2021-03-08T22:02:32.000Z,1369045899922444290,636485312,-1,1369045899922444290,1,8,12,"Did Bari Weiss object to the withdrawal of Pernkop's Anatomy, whose illustrations were drawn from the dissected corpses of people who died in Nazi concentration camps? By all accounts, it had more educational value than Dr. Seuss' books, though substitutes are available for both.",Dr Seuss,1
2021-03-08T22:01:57.000Z,1369045752517963778,108338399,-1,1369045752517963778,1,12,177,Me on day 7 of the Dr. Seuss discourse https://t.co/3Iyo6V4I02,Dr Seuss,1
2021-03-08T22:00:28.000Z,1369045377236799488,19816859,-1,1369045377236799488,3,3,17,Op-Ed: Pulling racist Dr. Seuss books makes kids’ literature better and more inclusive | @washingtonpost https://t.co/raFqwtCzEZ https://t.co/WlpSZKU1of,Dr Seuss,1
2021-03-08T22:00:08.000Z,1369045295368200194,18086993,-1,1369045295368200194,1,3,4,"One irony of the Dr. Seuss cancellation is that Theodor Geisel himself was a man of the Left, whose later cartoons and books opposed fascism, “red baiting,” and racial bigotry. https://t.co/96PS5U4D0k via @cjstevem",Dr Seuss,1
2021-03-08T21:52:12.000Z,1369043298002812930,200583835,-1,1369043298002812930,0,27,56,Don't give up. I believe in you all. A person's a person no matter how small. - Dr. Seuss,Dr Seuss,1
2021-03-08T21:43:00.000Z,1369040984697270272,23857710,-1,1369040984697270272,0,9,17,"Mr potato head...dr seuss...looney tunes...ok, this has gone too far, yall seriously gotta chill 😂😂",Dr Seuss,1
2021-03-08T21:41:30.000Z,1369040605603635200,21514744,-1,1369040605603635200,116,28,861,"I haven't been paying attention today, are they still going about Dr Seuss?",Dr Seuss,1
2021-03-08T21:37:51.000Z,1369039688045129731,287451514,-1,1369039688045129731,1,0,2,"Well, the Dr. Seuss estate doesn't have the ability to stop drone strikes, but I'm completely down with cancelling drone strikes. https://t.co/kbxq5VLQsX",Dr Seuss,1
2021-03-08T21:20:38.000Z,1369035354804785161,334920737,-1,1369035354804785161,4,4,40,McCarthy gave a heartfelt reading of the Seuss classic “Green Eggs and Ham” on Twitter. https://t.co/zMSaGbhHuU,Dr Seuss,1
2021-03-08T21:20:04.000Z,1369035212081004546,16012783,-1,1369035212081004546,128,90,430,"“OK, first: shut the fuck up, Tucker, you fearmongering lacrosse injury,” exclaimed Oliver. “And second, it’s a little weird to claim that mid-century American culture championed colorblindness when signs from the times explicitly demanded the opposite.” https://t.co/RavxZyMNAH",Dr Seuss,1
2021-03-08T21:16:53.000Z,1369034410352279553,24431892,-1,1369034410352279553,1,10,47,If only this would trump the culture war bullshit. Republicans know they lose on this so ... Dr Seuss! https://t.co/YHOWkbTziu,Dr Seuss,1
2021-03-08T21:15:34.000Z,1369034077844631553,45499837,-1,1369034077844631553,24,229,2148,"This has been a hard year, but right now, somewhere in the country, a white supremacist is getting a tattoo of Pepe Le Pew reading a Dr. Seuss book, and that's something we can all think about and enjoy.",Dr Seuss,1
2021-03-08T21:02:34.000Z,1369030807361368073,14133760,-1,1369030807361368073,16,24,62,New column: Jake Tapper’s ‘Empirically Racist’ Dr. Seuss Nonsense https://t.co/RiyM9NvsP7,Dr Seuss,1
2021-03-08T21:02:20.000Z,1369030748301328386,16973333,-1,1369030748301328386,3,5,23,Cindy McCain calls GOP and Fox News fury over Dr Seuss ‘ridiculous’ https://t.co/28WN6Q8lpv,Dr Seuss,1
2021-03-08T20:55:44.000Z,1369029089311481863,18295206,-1,1369029089311481863,15,24,214,Fighting about bagels &gt; fighting about Dr Seuss &gt; fighting about Mr Potatohead &gt; contemplating the futility of existence &gt; accepting the inevitability of death,Dr Seuss,1
2021-03-08T20:47:49.000Z,1369027094991241220,4686170306,-1,1369027094991241220,5,20,79,"""But nonracism—the idea that skin color should be overlooked—has lost popularity among progressive activists, and anti-racism—the idea that skin color matters a great deal—is in vogue."" https://t.co/f3aJb5BPP9",Dr Seuss,1
2021-03-08T20:44:27.000Z,1369026250073804800,16302354,-1,1369026250073804800,1,1,2,"Democrats go big, deliver on priorities.

Republicans talk about Dr. Seuss, stoke fear of immigrants.
https://t.co/qAmkG6THkF",Dr Seuss,1
2021-03-08T20:42:24.000Z,1369025730739384325,457984599,-1,1369025730739384325,604,56,245,Cindy McCain has a message for conservatives: https://t.co/pWUwZ1cSqH,Dr Seuss,1
2021-03-08T20:39:20.000Z,1369024959889170433,21733692,-1,1369024959889170433,4,78,389,"Elections matter. Both sides aren't the same. Biden Administration is getting millions of Americans vaccinated because they believe in science and care about health and security. Also every Democrat voted for a stimulus package. 

0 Republicans did. 0.

But Dr. Seuss!!!",Dr Seuss,1
2021-03-08T20:38:15.000Z,1369024687510982659,14982315,-1,1369024687510982659,39,106,1267,"It’s time for intelligent conservatives - the ones who know the election wasn’t stolen, the estate of Dr. Seuss has the right to do what they want with their books &amp; no one really cares about using the term “Neanderthal”- to take the lead &amp; quit playing this dumb game. A+ thread. https://t.co/Fc0uV46etn",Dr Seuss,1
2021-03-08T20:38:03.000Z,1369024636193738757,3135241,-1,1369024636193738757,1,7,15,"The Woefully Ignorant Media Is Getting America's Anger Over the Cancelation of Dr. Seuss Books So Wrong, So Let Me Help https://t.co/z1fXiwdLGP",Dr Seuss,1
2021-03-08T20:24:38.000Z,1369021262417129475,14770131,-1,1369021262417129475,6,4,30,"Nobody *loves* Pepe LePew. I doubt many people have any of those 6 Dr. Seuss titles as their favorites, either. What people love is for things not to change.",Dr Seuss,1
2021-03-08T20:16:41.000Z,1369019261629333506,892219807,-1,1369019261629333506,35,25,160,Kevin McCarthy Blasts Relief Package for Failing to Address Dr. Seuss Crisis | The New Yorker https://t.co/sbevAKNIBJ,Dr Seuss,1
2021-03-08T20:15:31.000Z,1369018967885484032,453319164,-1,1369018967885484032,1,19,114,"Biden’s unrecognized achievement: Rolling back the culture war &amp; creating a new politics of bread-and-butter. The GOP talks about Dr. Seuss &amp; cancel culture. Biden focuses relentlessly on the pandemic, help for the displaced &amp; economic recovery.
My column https://t.co/C9RF1ru17D",Dr Seuss,1
2021-03-08T20:15:03.000Z,1369018851195772940,16870352,-1,1369018851195772940,0,2,4,OPINION: Dr. Seuss controversy brings to light importance of diversity in children’s literature https://t.co/HAmmvQYKjb #drseuss,Dr Seuss,1
2021-03-08T20:04:02.000Z,1369016076487561224,30450430,-1,1369016076487561224,0,1,0,How Dr. Seuss became the second highest-paid dead celebrity https://t.co/zEsfm4cCDY https://t.co/kd6vXbESWP,Dr Seuss,1
2021-03-08T20:00:11.000Z,1369015108039565315,1181704852201558018,-1,1369015108039565315,0,0,1,Tammi and her Friday co-hosts will discuss the political and trending highlights of the week. And topics that are impacting the Black community.​  https://t.co/qU50FOcA6o,Dr Seuss,1
2021-03-08T19:50:05.000Z,1369012566144540676,29616287,-1,1369012566144540676,0,0,0,"If Dr. Seuss wrote musicals they would have just hired somebody to rewrite them and not tell anybody about it.  (Or stick a tiny ""additional material by"" credit where nobody will see it.)",Dr Seuss,1
2021-03-08T19:50:00.000Z,1369012544501936136,143145579,-1,1369012544501936136,0,0,2,"This Republican politician read Green Eggs and Ham to feign outrage over fake cancel culture – 7 scathing takedowns.
https://t.co/H8O8BGjKUi https://t.co/2rkGsFJsea",Dr Seuss,1
2021-03-08T19:49:17.000Z,1369012365157535744,4429372933,-1,1369012365157535744,2,0,10,"since no one on the conservative side of this ""dr seuss censorship"" shit actually thinks this is a real problem or is even proposing doing anything abt it, wouldnt it be a better use of everyone elses time to just ignore it completely and focus on actual problems",Dr Seuss,1
2021-03-08T19:31:02.000Z,1369007773376200706,57441414,-1,1369007773376200706,153,944,4626,"The government has been gleefully trampling all over our most basic human rights and civil liberties for over a year.

But what are people outraged by?
- Harry &amp; Meghan
- The gender of a toy potato
- Dr. Seuss books being 'racist'

Humans deserve to be conquered. 😂",Dr Seuss,1
2021-03-08T19:28:39.000Z,1369007172860878849,57266089,-1,1369007172860878849,2,0,3,Jim Davis right now furiously drawing racist Garfields that he can publish and then pull out of circulation. https://t.co/04wEkQMs4w,Dr Seuss,1
2021-03-08T19:24:02.000Z,1369006012250943491,1337090583849037828,-1,1369006012250943491,3,34,147,"""They’ve been focusing largely on things like Dr. Seuss and talking about immigration and not really talking about this bill. It seems like they kind of know it’s popular and they’re not really sure how to fight against it,” -@EugeneDaniels2 on Republican relief bill messaging https://t.co/Obu6Maq0h3",Dr Seuss,1
2021-03-08T19:15:02.000Z,1369003743920984065,2361224263,-1,1369003743920984065,1,7,7,The hottest theme in liberal punditry is mocking conservatives for their objections to woke culture’s long march through American entertainment conglomerates. https://t.co/XdpWlhHV77,Dr Seuss,1
2021-03-08T19:02:05.000Z,1369000486943219714,18589998,-1,1369000486943219714,3,9,15,Killing Dr. Seuss (you can call it A Bedtime Story for Today) honors what is quickly becoming the memory of the beloved children’s author in a unique way. Watch Andy read (or follow along yourself) here: https://t.co/nhKgLHiVp5 https://t.co/XqCping1cf,Dr Seuss,1
2021-03-08T19:00:00.000Z,1368999964177797127,65243567,-1,1368999964177797127,1,3,7,"Our editorial board says no one's canceling Dr. Seuss (nor should they), but after more than 20 years with Dr. Seuss at the center of Read Across America Day, it's time to move beyond ""The Cat and the Hat"" and elevate lesser-known children's authors. https://t.co/w1HUwPKMfV",Dr Seuss,1
2021-03-08T19:00:00.000Z,1368999963645140992,19189064,-1,1368999963645140992,0,0,2,"Our editorial board says no one's canceling Dr. Seuss (nor should they), but after more than 20 years with Dr. Seuss at the center of Read Across America Day, it's time to move beyond ""The Cat and the Hat"" and elevate lesser-known children's authors. https://t.co/uFRHrfrcL1",Dr Seuss,1
2021-03-08T18:52:46.000Z,1368998141383610368,31136822,-1,1368998141383610368,0,2,8,Haltiwanger figured out that the Dr. Seuss books were all that was standing between white people and their numbers dwindling to below those of other races. How did he crack the code? https://t.co/fzOU6d7NW8,Dr Seuss,1
2021-03-08T18:37:48.000Z,1368994376085561346,755677202,-1,1368994376085561346,121,582,2605,"No one cares about the royal family or Dr. Seuss.

50 million Americans can't afford groceries, our Senate just rejected a $15 minimum wage, and new COVID variants keep popping up. Talk about that instead.",Dr Seuss,1
2021-03-08T18:29:05.000Z,1368992183869714435,2224079705,-1,1368992183869714435,3,12,91,"You can't buy six Dr. Seuss books on eBay because of ""racism,"" but you can still buy books from:

-Hitler
-David Duke
-Karl Marx
-Lous Farrakhan 

Consistency is fun!",Dr Seuss,1
2021-03-08T18:28:55.000Z,1368992138139078659,60125871,-1,1368992138139078659,6,39,527,Y’all motherfuckers out here talking about Dr. Seuss when Woody Allen is not in jail. Fucks sake. Allen v Farrow is some R Kelly level shit. Society just really really hates women.,Dr Seuss,1
2021-03-08T18:28:29.000Z,1368992032576901126,48797538,-1,1368992032576901126,2,1,16,"OK I definitely missed those Dr. Seuss books but I'm glad to know that Tucker Carlson will spend $50,000 to buy a copy of each on ebay https://t.co/yPWVyATXnF",Dr Seuss,1
2021-03-08T18:26:51.000Z,1368991621254180870,1006577189012299776,-1,1368991621254180870,363,1462,9781,"Dr. Seuss canceled today, the Constitution canceled tomorrow.",Dr Seuss,1
2021-03-08T18:12:07.000Z,1368987911677444098,25691305,-1,1368987911677444098,0,0,0,The @chipublib will temporarily pull 6 Dr. Seuss books from its shelves while deciding how to handle these titles that Dr. Seuss Enterprises will no longer publish. https://t.co/D0G4iBvbTL,Dr Seuss,1
2021-03-08T18:11:39.000Z,1368987794576580609,10696392,-1,1368987794576580609,1,1,5,"This thread is the most succinct explanation of the bad faith Dr. Seuss nonsense emanating from the right, and all the other bad faith nonsense that preceded it. https://t.co/FTHw7T9pKj",Dr Seuss,1
2021-03-08T18:07:09.000Z,1368986663767130113,14708814,-1,1368986663767130113,1,0,4,"In the summer of 1936, Theodor Geisel was on a ship from Europe to New York when he started scribbling silly rhymes on the ship’s stationery to entertain himself during a storm. From The New York Times: https://t.co/yIhlCLeJNn",Dr Seuss,1
2021-03-08T18:07:09.000Z,1368986663326736385,14527393,-1,1368986663326736385,0,0,1,"In the summer of 1936, Theodor Geisel was on a ship from Europe to New York when he started scribbling silly rhymes on the ship’s stationery to entertain himself during a storm. From The New York Times: https://t.co/4W2cxvxQws",Dr Seuss,1
2021-03-08T18:07:06.000Z,1368986650198556684,1429761,-1,1368986650198556684,1,0,4,"In the summer of 1936, Theodor Geisel was on a ship from Europe to New York when he started scribbling silly rhymes on the ship’s stationery to entertain himself during a storm. From The New York Times: https://t.co/cxnLKve4Oo https://t.co/b62v2qBPHh",Dr Seuss,1
2021-03-08T18:07:06.000Z,1368986649368072192,12699932,-1,1368986649368072192,1,1,0,"In the summer of 1936, Theodor Geisel was on a ship from Europe to New York when he started scribbling silly rhymes on the ship’s stationery to entertain himself during a storm. From The New York Times: https://t.co/etc3Ce8Bc5 https://t.co/WxRyc1H2Zm",Dr Seuss,1
2021-03-08T18:04:34.000Z,1368986010542084099,19310250,-1,1368986010542084099,0,1,3,"Seuss cancellations illustrate how disappearance happens w/o legal “ban”. Seuss estate decides to self-censor; that lets eBay delist used copies. In cultural landscape dominated by big firms with politically uniform bosses, you don’t need state censorship https://t.co/G8C0OswxEJ",Dr Seuss,1
2021-03-08T18:01:03.000Z,1368985128454692866,223904974,-1,1368985128454692866,3,1,21,Dr Seuss’s Bisex Angels have been cancelled! https://t.co/9ulzqoHm2Z,Dr Seuss,1
2021-03-08T18:00:05.000Z,1368984883876438017,4081106480,-1,1368984883876438017,58,440,1755,"EBay Canceled Dr. Seuss, But You Can Still Buy Works From Hitler, Marx And More https://t.co/o58XDBVa3L https://t.co/pGcIh2u8B0",Dr Seuss,1
2021-03-08T18:00:02.000Z,1368984869439631360,71361799,-1,1368984869439631360,0,1,3,"Opinion: Dr. Seuss was not “cancelled.”
By Catherine Hurley
https://t.co/UwIoNs8Yfe",Dr Seuss,1
2021-03-08T17:57:03.000Z,1368984122169950208,14946895,-1,1368984122169950208,0,0,0,"In the summer of 1936, Theodor Geisel was on a ship from Europe to New York when he started scribbling silly rhymes on the ship’s stationery to entertain himself during a storm. From The New York Times: https://t.co/Xl3UfLG8xU",Dr Seuss,1
2021-03-08T17:56:30.000Z,1368983981744680960,19956739,-1,1368983981744680960,0,1,1,"Alright internet, I’m ready to be canceled. Look at what reading Dr. Seuss as a child did to me. 👉 https://t.co/nfCxhDYGId",Dr Seuss,1
2021-03-08T17:46:44.000Z,1368981523924418566,27987687,-1,1368981523924418566,1,4,13,"Republican Kevin McCarthy stages pathetic Dr Seuss protest. Meanwhile, Americans are dying of COVID https://t.co/HBwBy4vUV3",Dr Seuss,1
2021-03-08T17:41:50.000Z,1368980292128620552,318393568,-1,1368980292128620552,0,0,1,One of the Dr. Seuss books in question had previously been edited due to one of the images in question. Why not just… edit them again?,Dr Seuss,1
2021-03-08T17:40:04.000Z,1368979847054323715,24127811,-1,1368979847054323715,35,124,558,"While book-bannings of the past were frequently a reaction to the perceived subversive power of certain books, what’s interesting about the current wave is no one perceives Dr. Seuss (for example) as subversive. Instead an opaque Committee of “experts” decrees what is “harmful” https://t.co/qzsegBr26N",Dr Seuss,1
2021-03-08T17:31:12.000Z,1368977616770842626,18956073,-1,1368977616770842626,6,10,9,"Chicagoans will no longer be able to check out copies of ""racist”  Dr. Seuss books from the @chipublib.

 https://t.co/rrtTOfrWuJ",Dr Seuss,1
2021-03-08T17:24:14.000Z,1368975860460621830,42724842,-1,1368975860460621830,0,0,0,"As someone who is merely an observer in the Dr. Seuss culture wars, I would like to remind everyone of this marvelous thing that happened on the internet about ten years ago. https://t.co/8mtft1BwdQ",Dr Seuss,1
2021-03-08T17:23:15.000Z,1368975614280077321,40145940,-1,1368975614280077321,2,4,9,"Nice talking point but factually inaccurate.

Cons are the ones reading bad Dr. Seuss takes and complaining about a potato. https://t.co/LdGoNV4haI",Dr Seuss,1
2021-03-08T17:11:28.000Z,1368972650869968898,549023337,-1,1368972650869968898,5,7,41,"If watching Disney and Dr. Seuss pull racist content that we consumed as kids doesn't prove the environment we grew up in was saturated with harmful depictions of POC, when will you ever be able to admit you were conditioned for racism and carried that with you into adulthood?",Dr Seuss,1
2021-03-08T17:07:39.000Z,1368971687820206082,152448004,-1,1368971687820206082,3,1,62,Why are racists fighting so hard for the Dr Seuss books that no one reads?,Dr Seuss,1
2021-03-08T17:02:03.000Z,1368970281205837824,67769080,-1,1368970281205837824,1,0,1,"Those Dr. Seuss books were racist, though.",Dr Seuss,1
2021-03-08T16:56:01.000Z,1368968760376360962,469194846,-1,1368968760376360962,0,3,13,Business Insider journo explains that conservatives' 'obsession' with Dr. Seuss et al. stems from 'their fear of white people becoming a minority' https://t.co/22kmIvEidy,Dr Seuss,1
2021-03-08T16:46:20.000Z,1368966323376689156,64452472,-1,1368966323376689156,2,0,19,Oh... okay... I can see now why some of Dr Seuss’ stuff had to get pulled. Yikes! https://t.co/k0jQHyl41M,Dr Seuss,1
2021-03-08T16:44:31.000Z,1368965866532917248,373604983,-1,1368965866532917248,0,1,5,John Oliver on Sunday night lambasted Fox News and Glenn Beck over their reactions to the news six Dr. Seuss books would cease being published due to racist imagery https://t.co/arPDJFH0yR,Dr Seuss,1
2021-03-08T16:42:31.000Z,1368965365452115973,17446621,-1,1368965365452115973,5,6,74,John Oliver Blasts Fox News Over Dr. Seuss “Bulls*** Culture War” Reaction https://t.co/wGA5ycSHBc,Dr Seuss,1
